,symbol,full name,market,sector,sub-sector
192,CPTGF,กองทุนรวมสิทธิการเช่าอสังหาริมทรัพย์ ซี.พี.ทาวเวอร์ โกรท,SET,PROPCON,PF&REIT
193,CPW,บริษัท คอปเปอร์ ไวร์ด จำกัด (มหาชน),SET,SERVICE,COMM
194,CRANE,บริษัท ชูไก จำกัด (มหาชน),SET,INDUS,IMM
195,CRC,บริษัท เซ็นทรัล รีเทล คอร์ปอเรชั่น จำกัด (มหาชน),SET,SERVICE,COMM
196,CRD,บริษัท เชียงใหม่ริมดอย จำกัด (มหาชน),mai,PROPCON,
197,CREDIT,ธนาคารไทยเครดิต จำกัด (มหาชน),SET,FINCIAL,BANK
198,CSC,บริษัท ฝาจีบ จำกัด (มหาชน),SET,INDUS,PKG
199,CSP,บริษัท ซีเอสพี สตีลเซ็นเตอร์ จำกัด (มหาชน),SET,INDUS,STEEL
200,CSR,บริษัท เทพธานีกรีฑา จำกัด (มหาชน),SET,SERVICE,TOURISM
201,CSS,บริษัท คอมมิวนิเคชั่น แอนด์ ซิสเต็มส์ โซลูชั่น จำกัด (มหาชน),SET,SERVICE,COMM
202,CTARAF,กองทุนรวมสิทธิการเช่าอสังหาริมทรัพย์โรงแรมและรีสอร์ทในเครือฯ,SET,PROPCON,PF&REIT
203,CTW,บริษัท จรุงไทยไวร์แอนด์เคเบิ้ล จำกัด (มหาชน),SET,INDUS,IMM
204,CV,บริษัท โคลเวอร์ เพาเวอร์ จำกัด (มหาชน),SET,RESOURC,ENERG
205,CWT,บริษัท ชัยวัฒนา แทนเนอรี่ กรุ๊ป จำกัด (มหาชน),SET,INDUS,AUTO
206,D,บริษัท เดนทัล คอร์ปอเรชั่น จำกัด (มหาชน),mai,SERVICE,
207,DCC,บริษัท ไดนาสตี้เซรามิค จำกัด (มหาชน),SET,PROPCON,CONMAT
208,DCON,บริษัท ดีคอนโปรดักส์ จำกัด (มหาชน),SET,PROPCON,CONMAT
209,DDD,บริษัท ดู เดย์ ดรีม จำกัด (มหาชน),SET,CONSUMP,PERSON
210,DELTA,บริษัทเดลต้า อีเลคโทรนิคส์ (ประเทศไทย) จำกัด (มหาชน),SET,TECH,ETRON
211,DEMCO,บริษัท เด็มโก้ จำกัด (มหาชน),SET,RESOURC,ENERG
212,DEXON,บริษัท เด็กซ์ซอน เทคโนโลยี จำกัด (มหาชน),mai,SERVICE,
213,DHOUSE,บริษัท ดีเฮ้าส์พัฒนา จำกัด (มหาชน),mai,PROPCON,
214,DIMET,บริษัท ไดเมท (สยาม) จำกัด (มหาชน),mai,PROPCON,
215,DITTO,บริษัท ดิทโต้ (ประเทศไทย) จำกัด (มหาชน),SET,TECH,ICT
216,DMT,บริษัท ทางยกระดับดอนเมือง จำกัด (มหาชน),SET,SERVICE,TRANS
217,DOD,บริษัท ดีโอดี ไบโอเทค จำกัด (มหาชน),mai,CONSUMP,
218,DOHOME,บริษัท ดูโฮม จำกัด (มหาชน),SET,SERVICE,COMM
219,DPAINT,บริษัท สีเดลต้า จำกัด (มหาชน),mai,PROPCON,
220,DREIT,ทรัสต์เพื่อการลงทุนในอสังหาริมทรัพย์และสิทธิการเช่าดุสิตธานี,SET,PROPCON,PF&REIT
221,DRT,บริษัท ผลิตภัณฑ์ตราเพชร จำกัด (มหาชน),SET,PROPCON,CONMAT
222,DTCENT,บริษัท ดี.ที.ซี. เอ็นเตอร์ไพรส์ จำกัด (มหาชน),SET,TECH,ICT
223,DTCI,บริษัท ดี.ที.ซี.อินดัสตรี่ส์ จำกัด (มหาชน),SET,CONSUMP,HOME
224,DUSIT,บริษัท ดุสิตธานี จำกัด (มหาชน),SET,SERVICE,TOURISM
225,DV8,บริษัท ดีวี8 จำกัด (มหาชน),mai,SERVICE,
226,EA,บริษัท พลังงานบริสุทธิ์ จำกัด (มหาชน),SET,RESOURC,ENERG
227,EASON,บริษัท อีซึ่น แอนด์ โค จำกัด (มหาชน),SET,INDUS,AUTO
228,EASTW,บริษัท จัดการและพัฒนาทรัพยากรน้ำภาคตะวันออก จำกัด (มหาชน),SET,RESOURC,ENERG
229,ECF,บริษัท อีสต์โคสท์เฟอร์นิเทค จำกัด (มหาชน),mai,CONSUMP,
230,ECL,บริษัท ตะวันออกพาณิชย์ลีสซิ่ง จำกัด (มหาชน),SET,FINCIAL,FIN
231,EE,บริษัท อีเทอเนิล เอนเนอยี จำกัด (มหาชน),SET,AGRO,AGRI
232,EFORL,บริษัท อี ฟอร์ แอล เอม จำกัด (มหาชน),mai,CONSUMP,
233,EGCO,บริษัท ผลิตไฟฟ้า จำกัด (มหาชน),SET,RESOURC,ENERG
234,EKH,บริษัท เอกชัยการแพทย์ จำกัด (มหาชน),SET,SERVICE,HELTH
235,EMC,บริษัท อีเอ็มซี จำกัด (มหาชน),SET,PROPCON,CONS
236,EP,บริษัท อีสเทอร์น พาวเวอร์ กรุ๊ป จำกัด (มหาชน),SET,RESOURC,ENERG
237,EPG,บริษัท อีสเทิร์นโพลีเมอร์ กรุ๊ป จำกัด (มหาชน),SET,PROPCON,CONMAT
238,ERW,บริษัท ดิ เอราวัณ กรุ๊ป จำกัด (มหาชน),SET,SERVICE,TOURISM
239,ESTAR,บริษัท อีสเทอร์น สตาร์ เรียล เอสเตท จำกัด (มหาชน),SET,PROPCON,PROP
240,ETC,บริษัท เอิร์ธ เท็ค เอนไวรอนเมนท์ จำกัด (มหาชน),SET,RESOURC,ENERG
241,ETE,บริษัท บูรพา เทคนิคอล เอ็นจิเนียริ่ง จำกัด (มหาชน),mai,SERVICE,
242,ETL,บริษัท ยูโรเอเชีย โทเทิล โลจิสติกส์ จำกัด (มหาชน),SET,SERVICE,TRANS
243,EURO,บริษัท ยูโร ครีเอชั่นส์ จำกัด (มหาชน),mai,CONSUMP,
244,EVER,บริษัท เอเวอร์แลนด์ จำกัด (มหาชน),SET,PROPCON,PROP
245,F&D,บริษัท ฟู้ดแอนด์ดริ๊งส์ จำกัด (มหาชน),SET,AGRO,FOOD
246,FANCY,บริษัท แฟนซีวู๊ด อินดัสตรีส จำกัด (มหาชน),SET,CONSUMP,HOME
247,FE,บริษัท ฟาร์อีสท์ เฟมไลน์ ดีดีบี จำกัด (มหาชน),SET,SERVICE,MEDIA
248,FLOYD,บริษัท ฟลอยด์ จำกัด (มหาชน),mai,PROPCON,
249,FM,บริษัท ฟู้ดโมเม้นท์ จำกัด (มหาชน),SET,AGRO,FOOD
250,FMT,บริษัท ไฟน์ เม็ททัล เทคโนโลยีส์ จำกัด (มหาชน),SET,INDUS,IMM
251,FN,บริษัท เอฟเอ็น แฟคตอรี่ เอ๊าท์เลท จำกัด (มหาชน),SET,SERVICE,COMM
252,FNS,บริษัท เอฟเอ็นเอส โฮลดิ้งส์ จำกัด (มหาชน),SET,FINCIAL,FIN
253,FORTH,บริษัท ฟอร์ท คอร์ปอเรชั่น  จำกัด (มหาชน),SET,TECH,ICT
254,FPI,บริษัท ฟอร์จูน พาร์ท อินดัสตรี้ จำกัด (มหาชน),mai,INDUS,
255,FPT,บริษัท เฟรเซอร์ส พร็อพเพอร์ตี้ (ประเทศไทย) จำกัด (มหาชน),SET,PROPCON,PROP
256,FSMART,บริษัท ฟอร์ท สมาร์ท เซอร์วิส จำกัด (มหาชน),mai,SERVICE,
257,FSX,บริษัท ฟินันเซีย เอกซ์ จำกัด (มหาชน),SET,FINCIAL,FIN
258,FTE,บริษัท ไฟร์เทรดเอ็นจิเนียริ่ง จำกัด (มหาชน),SET,INDUS,IMM
259,FTI,บริษัท ฟังก์ชั่น อินเตอร์เนชั่นแนล จำกัด (มหาชน),SET,CONSUMP,HOME
260,FTREIT,ทรัสต์เพื่อการลงทุนในอสังหาริมทรัพย์และสิทธิการเช่าอสังหาริมทรัพย์เพื่ออุตสาหกรรม เฟรเซอร์ส พร็อพเพอร์ตี้,SET,PROPCON,PF&REIT
261,FUTUREPF,กองทุนรวมสิทธิการเช่าอสังหาริมทรัพย์ฟิวเจอร์พาร์ค,SET,PROPCON,PF&REIT
262,FVC,บริษัท ฟิลเตอร์ วิชั่น จำกัด (มหาชน),mai,SERVICE,
263,GABLE,บริษัท จีเอเบิล จำกัด (มหาชน),SET,TECH,ICT
264,GAHREIT,ทรัสต์เพื่อการลงทุนในอสังหาริมทรัพย์ แกรนด์ โฮสพีทาลิตี้,SET,PROPCON,PF&REIT
265,GBX,บริษัท โกลเบล็ก โฮลดิ้ง แมนเนจเม้นท์ จำกัด (มหาชน),SET,FINCIAL,FIN
266,GC,บริษัท โกลบอล คอนเน็คชั่นส์ จำกัด (มหาชน),SET,INDUS,PETRO
267,GCAP,บริษัท จี แคปปิตอล จำกัด (มหาชน),mai,FINCIAL,
268,GEL,บริษัท เจนเนอรัล เอนจิเนียริ่ง จำกัด (มหาชน),SET,PROPCON,CONMAT
269,GENCO,บริษัทบริหารและพัฒนาเพื่อการอนุรักษ์สิ่งแวดล้อม จำกัด(มหาชน),SET,SERVICE,PROF
270,GFC,บริษัท เจเนซีส เฟอร์ทิลีตี เซ็นเตอร์ จำกัด (มหาชน),mai,SERVICE,
271,GFPT,บริษัท จีเอฟพีที จำกัด (มหาชน),SET,AGRO,AGRI
272,GGC,บริษัท โกลบอลกรีนเคมิคอล จำกัด (มหาชน),SET,INDUS,PETRO
273,GIFT,บริษัท กิฟท์ อินฟินิท จำกัด (มหาชน),SET,INDUS,PETRO
274,GJS,บริษัท จี เจ สตีล จำกัด (มหาชน),SET,INDUS,STEEL
275,GL,บริษัท กรุ๊ปลีส จำกัด (มหาชน),SET,FINCIAL,FIN
276,GLAND,บริษัท แกรนด์ คาแนล แลนด์ จำกัด (มหาชน),SET,PROPCON,PROP
277,GLOBAL,บริษัท สยามโกลบอลเฮ้าส์ จำกัด (มหาชน),SET,SERVICE,COMM
278,GLOCON,บริษัท โกลบอล คอนซูเมอร์ จำกัด (มหาชน),SET,AGRO,FOOD
279,GLORY,บริษัท รุ่งเรืองตลอดไป จำกัด (มหาชน),mai,SERVICE,
280,GPI,บริษัท กรังด์ปรีซ์ อินเตอร์เนชั่นแนล จำกัด (มหาชน),SET,SERVICE,MEDIA
281,GPSC,บริษัท โกลบอล เพาเวอร์ ซินเนอร์ยี่ จำกัด (มหาชน),SET,RESOURC,ENERG
282,GRAMMY,บริษัท จีเอ็มเอ็ม แกรมมี่ จำกัด (มหาชน),SET,SERVICE,MEDIA
283,GRAND,บริษัท แกรนด์ แอสเสท โฮเทลส์ แอนด์ พรอพเพอร์ตี้ จำกัด(มหาชน),SET,SERVICE,TOURISM
284,GREEN,บริษัท กรีน รีซอร์สเซส จำกัด (มหาชน),SET,RESOURC,ENERG
285,GROREIT,ทรัสต์เพื่อการลงทุนในอสังหาริมทรัพย์ แกรนด์ รอยัล ออคิด โฮสพีทาลิตี้ ที่มีข้อตกลงในการซื้อคืน,SET,PROPCON,PF&REIT
286,GSC,บริษัท โกลบอล เซอร์วิส เซ็นเตอร์ จำกัด (มหาชน),mai,SERVICE,
287,GSTEEL,บริษัท จี สตีล จำกัด (มหาชน),SET,INDUS,STEEL
288,GTB,บริษัท เจตาแบค จำกัด (มหาชน),mai,INDUS,
289,GTV,บริษัท กรีนเทค เวนเจอร์ส จำกัด (มหาชน),mai,RESOURC,
290,GULF,บริษัท กัลฟ์ เอ็นเนอร์จี ดีเวลลอปเมนท์ จำกัด (มหาชน),SET,RESOURC,ENERG
291,GUNKUL,บริษัท กันกุลเอ็นจิเนียริ่ง จำกัด (มหาชน),SET,RESOURC,ENERG
292,GVREIT,ทรัสต์เพื่อการลงทุนในสิทธิการเช่าอสังหาริมทรัพย์โกลเด้นเวนเจอร์,SET,PROPCON,PF&REIT
293,GYT,บริษัท กู๊ดเยียร์(ประเทศไทย) จำกัด (มหาชน),SET,INDUS,AUTO
294,HANA,บริษัท ฮานา ไมโครอิเล็คโทรนิคส จำกัด (มหาชน),SET,TECH,ETRON
295,HARN,บริษัท หาญ เอ็นจิเนียริ่ง โซลูชั่นส์ จำกัด (มหาชน),mai,INDUS,
296,HEALTH,บริษัท เฮลท์ เอ็มไพร์ คอร์ปอเรชั่น จำกัด (มหาชน),mai,SERVICE,
297,HENG,บริษัท เฮงลิสซิ่ง แอนด์ แคปปิตอล จำกัด (มหาชน),SET,FINCIAL,FIN
298,HFT,บริษัท ฮั้วฟง รับเบอร์ (ไทยแลนด์) จำกัด (มหาชน),SET,INDUS,AUTO
299,HL,บริษัท เฮลท์ลีด จำกัด (มหาชน),mai,SERVICE,
300,HMPRO,บริษัท โฮม โปรดักส์ เซ็นเตอร์ จำกัด (มหาชน),SET,SERVICE,COMM
301,HPF,กองทุนรวมอสังหาริมทรัพย์และสิทธิการเช่าเหมราชอินดัสเตรียล,SET,PROPCON,PF&REIT
302,HPT,บริษัท โฮม พอตเทอรี่ จำกัด (มหาชน),mai,CONSUMP,
303,HTC,บริษัท หาดทิพย์ จำกัด (มหาชน),SET,AGRO,FOOD
304,HTECH,บริษัท แฮลเซี่ยน เทคโนโลยี่ จำกัด (มหาชน),SET,INDUS,IMM
305,HUMAN,บริษัท ฮิวแมนิก้า จำกัด (มหาชน),SET,TECH,ICT
306,HYDRO,บริษัท ไฮโดรเท็ค จำกัด (มหาชน),mai,PROPCON,
307,HYDROGEN,ทรัสต์เพื่อการลงทุนในอสังหาริมทรัพย์และสิทธิการเช่าไฮโดรเจน,SET,PROPCON,PF&REIT
308,I2,บริษัท ไอ ทู เอ็นเตอร์ไพรซ์ จำกัด (มหาชน),mai,TECH,
309,ICC,บริษัท ไอ.ซี.ซี. อินเตอร์เนชั่นแนล จำกัด (มหาชน),SET,SERVICE,COMM
310,ICHI,บริษัท อิชิตัน กรุ๊ป จำกัด (มหาชน),SET,AGRO,FOOD
311,ICN,บริษัท อินฟอร์เมชั่น แอนด์ คอมมิวนิเคชั่น เน็ทเวิร์คส จำกัด (มหาชน),SET,TECH,ICT
312,IFS,บริษัท ไอเอฟเอส แคปปิตอล (ประเทศไทย) จำกัด (มหาชน),SET,FINCIAL,FIN
313,IHL,บริษัท อินเตอร์ไฮด์ จำกัด (มหาชน),SET,INDUS,AUTO
314,IIG,บริษัท ไอแอนด์ไอ กรุ๊ป จำกัด (มหาชน),mai,TECH,
315,III,บริษัท ทริพเพิล ไอ โลจิสติกส์ จำกัด (มหาชน),SET,SERVICE,TRANS
316,ILINK,บริษัท อินเตอร์ลิ้งค์ คอมมิวนิเคชั่น จำกัด (มหาชน),SET,TECH,ICT
317,ILM,บริษัท อินเด็กซ์ ลิฟวิ่งมอลล์ จำกัด (มหาชน),SET,SERVICE,COMM
318,IMH,บริษัท โรงพยาบาลอินเตอร์เมดิคัล แคร์ แอนด์ แล็บ จำกัด (มหาชน),mai,SERVICE,
319,IMPACT,ทรัสต์เพื่อการลงทุนในอสังหาริมทรัพย์อิมแพ็คโกรท,SET,PROPCON,PF&REIT
320,IND,บริษัท อินเด็กซ์ อินเตอร์เนชั่นแนล กรุ๊ป จำกัด (มหาชน),mai,PROPCON,
321,INET,บริษัท อินเทอร์เน็ตประเทศไทย จำกัด (มหาชน),SET,TECH,ICT
322,INETREIT,ทรัสต์เพื่อการลงทุนในอสังหาริมทรัพย์และสิทธิการเช่าอสังหาริมทรัพย์ไอเน็ต,SET,PROPCON,PF&REIT
323,INGRS,บริษัท อิงเกรส อินดัสเตรียล (ไทยแลนด์) จำกัด (มหาชน),SET,INDUS,AUTO
324,INOX,บริษัท โพสโค-ไทยน๊อคซ์ จำกัด (มหาชน),SET,INDUS,STEEL
325,INSET,บริษัท อินฟราเซท จำกัด (มหาชน),SET,TECH,ICT
326,INSURE,บริษัท อินทรประกันภัย จำกัด (มหาชน),SET,FINCIAL,INSUR
327,INTUCH,บริษัท อินทัช โฮลดิ้งส์ จำกัด (มหาชน),SET,TECH,ICT
328,IP,บริษัท อินเตอร์ ฟาร์มา จำกัด (มหาชน),SET,CONSUMP,PERSON
329,IRC,บริษัท อีโนเว รับเบอร์ (ประเทศไทย) จำกัด (มหาชน),SET,INDUS,AUTO
330,IRCP,บริษัท อินเตอร์เนชั่นแนล รีเสริช คอร์ปอเรชั่น จำกัด (มหาชน),mai,TECH,
331,IRPC,บริษัท ไออาร์พีซี จำกัด (มหาชน),SET,RESOURC,ENERG
332,IT,บริษัท ไอที ซิตี้ จำกัด (มหาชน),SET,SERVICE,COMM
333,ITC,บริษัท ไอ-เทล คอร์ปอเรชั่น จำกัด (มหาชน),SET,AGRO,FOOD
334,ITD,บริษัท อิตาเลียนไทย ดีเวล๊อปเมนต์ จำกัด (มหาชน),SET,PROPCON,CONS
335,ITEL,บริษัท อินเตอร์ลิ้งค์ เทเลคอม จำกัด (มหาชน),SET,TECH,ICT
336,ITNS,บริษัท อินเตอร์เนชั่นแนล เน็ตเวิร์ค ซิสเต็ม จำกัด (มหาชน),mai,TECH,
337,ITTHI,บริษัท อิทธิฤทธิ์ ไนซ์ คอร์ปอเรชั่น จำกัด (มหาชน),mai,CONSUMP,
338,IVL,บริษัท อินโดรามา เวนเจอร์ส จำกัด (มหาชน),SET,INDUS,PETRO
339,J,บริษัท เจเอเอส แอสเซ็ท จำกัด (มหาชน),SET,PROPCON,PROP
340,JAK,บริษัท จักรไพศาล เอสเตท จำกัด (มหาชน),mai,PROPCON,
341,JAS,บริษัท จัสมิน อินเตอร์เนชั่นแนล จำกัด (มหาชน),SET,TECH,ICT
342,JCK,บริษัท เจซีเค อินเตอร์เนชั่นแนล จำกัด (มหาชน),SET,PROPCON,PROP
343,JCKH,บริษัท เจซีเค ฮอสพิทอลลิตี้ จำกัด (มหาชน),mai,AGRO,
344,JCT,บริษัท แจ๊กเจียอุตสาหกรรม (ไทย) จำกัด (มหาชน),SET,CONSUMP,PERSON
345,JDF,บริษัท เจดีฟู้ด จำกัด (มหาชน),SET,AGRO,FOOD
346,JKN,บริษัท เจเคเอ็น โกลบอล กรุ๊ป จำกัด (มหาชน),SET,SERVICE,MEDIA
347,JMART,บริษัท เจมาร์ท กรุ๊ป โฮลดิ้งส์ จำกัด (มหาชน),SET,TECH,ICT
348,JMT,บริษัท เจ เอ็ม ที เน็ทเวอร์ค เซอร์วิสเซ็ส จำกัด (มหาชน),SET,FINCIAL,FIN
349,JPARK,บริษัท เจนก้องไกล จำกัด (มหาชน),mai,SERVICE,
350,JR,บริษัท เจ.อาร์.ดับเบิ้ลยู. ยูทิลิตี้ จำกัด (มหาชน),SET,PROPCON,CONS
351,JSP,บริษัท โรงงานเภสัชอุตสาหกรรม เจเอสพี (ประเทศไทย) จำกัด (มหาชน),mai,CONSUMP,
352,JTS,บริษัท จัสมิน เทคโนโลยี โซลูชั่น จำกัด (มหาชน),SET,TECH,ICT
353,JUBILE,บริษัท ยูบิลลี่ เอ็นเตอร์ไพรส์ จำกัด (มหาชน),mai,CONSUMP,
354,K,บริษัท คิงส์เมน ซี.เอ็ม.ที.ไอ. จำกัด (มหาชน),mai,PROPCON,
355,KAMART,บริษัท คาร์มาร์ท จำกัด (มหาชน),SET,SERVICE,COMM
356,KASET,บริษัท ไทยฮา จำกัด (มหาชน),mai,AGRO,
357,KBANK,ธนาคารกสิกรไทย จำกัด (มหาชน),SET,FINCIAL,BANK
358,KBS,บริษัท น้ำตาลครบุรี จำกัด (มหาชน),SET,AGRO,FOOD
359,KC,บริษัท เค.ซี. พร็อพเพอร์ตี้ จำกัด (มหาชน),SET,PROPCON,PROP
360,KCAR,บริษัท กรุงไทยคาร์เร้นท์ แอนด์ ลีส จำกัด (มหาชน),SET,FINCIAL,FIN
361,KCC,บริษัท ไนท คลับ แคปปิตอล โฮลดิ้ง จำกัด (มหาชน),mai,FINCIAL,
362,KCE,บริษัท เคซีอี อีเลคโทรนิคส์ จำกัด (มหาชน),SET,TECH,ETRON
363,KCG,บริษัท เคซีจี คอร์ปอเรชั่น จำกัด (มหาชน),SET,AGRO,FOOD
364,KCM,บริษัท เค.ซี.เมททอลชีท จำกัด (มหาชน),mai,INDUS,
365,KDH,บริษัท ธนบุรี เมดิเคิล เซ็นเตอร์ จำกัด (มหาชน),SET,SERVICE,HELTH
366,KEX,บริษัท เคอีเอ็กซ์ เอ็กซ์เพรส (ประเทศไทย) จำกัด (มหาชน),SET,SERVICE,TRANS
367,KGEN,บริษัท คิง เจน จำกัด (มหาชน),mai,SERVICE,
368,KGI,บริษัทหลักทรัพย์ เคจีไอ (ประเทศไทย) จำกัด (มหาชน),SET,FINCIAL,FIN
369,KIAT,บริษัท เกียรติธนา ขนส่ง จำกัด (มหาชน),SET,SERVICE,TRANS
370,KISS,บริษัท โรจูคิส อินเตอร์เนชั่นแนล จำกัด (มหาชน),SET,CONSUMP,PERSON
371,KJL,บริษัท กิจเจริญ เอ็นจิเนียริ่ง อีเลคทริค จำกัด (มหาชน),mai,INDUS,
372,KK,บริษัท เคแอนด์เค ซุปเปอร์สโตร์ เซาท์เทิร์น จำกัด (มหาชน),mai,SERVICE,
373,KKC,บริษัท กุลธรเคอร์บี้ จำกัด (มหาชน),SET,INDUS,IMM
374,KKP,ธนาคารเกียรตินาคินภัทร จำกัด (มหาชน),SET,FINCIAL,BANK
