,symbol,full name,market,sector,sub-sector
375,KLINIQ,บริษัท เดอะคลีนิกค์ คลินิกเวชกรรม จำกัด (มหาชน),mai,SERVICE,
376,KOOL,บริษัท ซีแอล เวนเจอร์ จำกัด (มหาชน),mai,SERVICE,
377,KPNPF,กองทุนรวมอสังหาริมทรัพย์เคพีเอ็น,SET,PROPCON,PF&REIT
378,KSL,บริษัท น้ำตาลขอนแก่น จำกัด (มหาชน),SET,AGRO,FOOD
379,KTB,ธนาคารกรุงไทย จำกัด (มหาชน),SET,FINCIAL,BANK
380,KTBSTMR,ทรัสต์เพื่อการลงทุนในอสังหาริมทรัพย์และสิทธิการเช่าอสังหาริมทรัพย์ เคทีบีเอสที มิกซ์,SET,PROPCON,PF&REIT
381,KTC,บริษัท บัตรกรุงไทย จำกัด (มหาชน),SET,FINCIAL,FIN
382,KTIS,บริษัท เกษตรไทย อินเตอร์เนชั่นแนล ชูการ์ คอร์ปอเรชั่น จำกัด (มหาชน),SET,AGRO,FOOD
383,KTMS,บริษัท เคที เมดิคอล เซอร์วิส จำกัด (มหาชน),mai,SERVICE,
384,KUMWEL,บริษัท คัมเวล คอร์ปอเรชั่น จำกัด (มหาชน),mai,INDUS,
385,KUN,บริษัท วิลล่า คุณาลัย จำกัด (มหาชน),SET,PROPCON,PROP
386,KWC,บริษัท กรุงเทพโสภณ จำกัด (มหาชน),SET,SERVICE,TRANS
387,KWI,บริษัท เคดับบลิวไอ จำกัด (มหาชน),SET,FINCIAL,INSUR
388,KWM,บริษัท เค. ดับบลิว. เม็ททัล เวิร์ค จำกัด (มหาชน),mai,INDUS,
389,KYE,บริษัท กันยงอีเลคทริก จำกัด (มหาชน),SET,CONSUMP,HOME
390,L&E,บริษัท ไลท์ติ้ง แอนด์ อีควิปเมนท์ จำกัด (มหาชน),SET,CONSUMP,HOME
391,LALIN,บริษัท ลลิล พร็อพเพอร์ตี้ จำกัด (มหาชน),SET,PROPCON,PROP
392,LANNA,บริษัท ลานนารีซอร์สเซส จำกัด (มหาชน),SET,RESOURC,ENERG
393,LDC,บริษัท แอลดีซี เด็นทัล จำกัด (มหาชน),mai,SERVICE,
394,LEE,บริษัท ลีพัฒนาผลิตภัณฑ์ จำกัด (มหาชน),SET,AGRO,AGRI
395,LEO,บริษัท ลีโอ โกลบอล โลจิสติกส์ จำกัด (มหาชน),mai,SERVICE,
396,LH,บริษัทแลนด์แอนด์เฮ้าส์ จำกัด (มหาชน),SET,PROPCON,PROP
397,LHFG,บริษัท แอล เอช ไฟแนนซ์เชียล กรุ๊ป จำกัด (มหาชน),SET,FINCIAL,BANK
398,LHHOTEL,ทรัสต์เพื่อการลงทุนในสิทธิการเช่าอสังหาริมทรัพย์ แอล เอช โฮเทล,SET,PROPCON,PF&REIT
399,LHK,บริษัท โลหะกิจ เม็ททอล จำกัด (มหาชน),SET,INDUS,STEEL
400,LHPF,กองทุนรวมอสังหาริมทรัพย์และสิทธิการเช่า แลนด์ แอนด์ เฮ้าส์,SET,PROPCON,PF&REIT
401,LHSC,ทรัสต์เพื่อการลงทุนในสิทธิการเช่าอสังหาริมทรัพย์ แอล เอช ช้อปปิ้ง เซ็นเตอร์,SET,PROPCON,PF&REIT
402,LIT,บริษัท ลีซ อิท จำกัด (มหาชน),mai,FINCIAL,
403,LOXLEY,บริษัท ล็อกซเล่ย์ จำกัด (มหาชน),SET,SERVICE,COMM
404,LPF,กองทุนรวมอสังหาริมทรัพย์และสิทธิการเช่าโลตัสส์ รีเทล โกรท,SET,PROPCON,PF&REIT
405,LPH,บริษัท โรงพยาบาล ลาดพร้าว จำกัด (มหาชน),SET,SERVICE,HELTH
406,LPN,บริษัท แอล.พี.เอ็น.ดีเวลลอปเมนท์ จำกัด (มหาชน),SET,PROPCON,PROP
407,LRH,บริษัท ลากูน่า รีสอร์ท แอนด์ โฮเท็ล จำกัด (มหาชน),SET,SERVICE,TOURISM
408,LST,บริษัท ล่ำสูง (ประเทศไทย) จำกัด (มหาชน),SET,AGRO,FOOD
409,LTS,บริษัท ไลท์อัพ โทเทิล โซลูชั่น จำกัด (มหาชน),mai,CONSUMP,
410,LUXF,กองทุนรวมอสังหาริมทรัพย์ลักซ์ชัวรี่,SET,PROPCON,PF&REIT
411,M,บริษัท เอ็มเค เรสโตรองต์ กรุ๊ป จำกัด (มหาชน),SET,AGRO,FOOD
412,MAGURO,บริษัท มากุโระ กรุ๊ป จำกัด (มหาชน),mai,AGRO,
413,MAJOR,บริษัท เมเจอร์ ซีนีเพล็กซ์ กรุ้ป จำกัด (มหาชน),SET,SERVICE,MEDIA
414,MALEE,บริษัท มาลีกรุ๊ป จำกัด (มหาชน),SET,AGRO,FOOD
415,MANRIN,บริษัท แมนดารินโฮเต็ล จำกัด (มหาชน),SET,SERVICE,TOURISM
416,MASTER,บริษัท มาสเตอร์ สไตล์ จำกัด (มหาชน),mai,SERVICE,
417,MATCH,บริษัท แม็ทชิ่ง แม็กซิไมซ์ โซลูชั่น จำกัด (มหาชน),SET,SERVICE,MEDIA
418,MATI,บริษัท มติชน จำกัด (มหาชน),SET,SERVICE,MEDIA
419,MBAX,บริษัท มัลติแบกซ์ จำกัด (มหาชน),mai,INDUS,
420,MBK,บริษัท เอ็ม บี เค จำกัด (มหาชน),SET,PROPCON,PROP
421,MC,บริษัท แม็คกรุ๊ป จำกัด (มหาชน),SET,SERVICE,COMM
422,MCA,บริษัท มาร์เก็ต คอนเน็กชั่นส์ เอเชีย จำกัด (มหาชน),mai,SERVICE,
423,M-CHAI,บริษัท โรงพยาบาลมหาชัย จำกัด (มหาชน),SET,SERVICE,HELTH
424,MCOT,บริษัท อสมท จำกัด (มหาชน),SET,SERVICE,MEDIA
425,MCS,บริษัท เอ็ม.ซี.เอส.สตีล จำกัด (มหาชน),SET,INDUS,STEEL
426,MDX,บริษัท เอ็ม ดี เอ็กซ์ จำกัด (มหาชน),SET,RESOURC,ENERG
427,MEB,บริษัท เมพ คอร์ปอเรชั่น จำกัด (มหาชน),mai,SERVICE,
428,MEGA,บริษัท เมก้า ไลฟ์ไซแอ็นซ์ จำกัด (มหาชน),SET,SERVICE,COMM
429,MENA,บริษัท มีนาทรานสปอร์ต จำกัด (มหาชน),SET,SERVICE,TRANS
430,META,บริษัท เมตะ คอร์ปอเรชั่น จำกัด (มหาชน),mai,PROPCON,
431,METCO,บริษัทมูราโมโต้ อีเล็คตรอน (ประเทศไทย) จำกัด (มหาชน),SET,TECH,ETRON
432,MFC,บริษัทหลักทรัพย์จัดการกองทุน เอ็มเอฟซี จำกัด(มหาชน),SET,FINCIAL,FIN
433,MFEC,บริษัท เอ็ม เอฟ อี ซี จำกัด (มหาชน),SET,TECH,ICT
434,MGC,บริษัท มิลเลนเนียม กรุ๊ป คอร์ปอเรชั่น (เอเชีย) จำกัด (มหาชน),SET,INDUS,AUTO
435,MGI,บริษัท มิสแกรนด์ อินเตอร์เนชั่นแนล จำกัด (มหาชน),mai,CONSUMP,
436,MGT,บริษัท เมกาเคม (ประเทศไทย) จำกัด (มหาชน),mai,INDUS,
437,MICRO,บริษัท ไมโครลิสซิ่ง จำกัด (มหาชน),SET,FINCIAL,FIN
438,MIDA,บริษัท ไมด้า แอสเซ็ท จำกัด (มหาชน),SET,SERVICE,COMM
439,M-II,กองทุนรวมอสังหาริมทรัพย์ และสิทธิการเช่า เอ็มเอฟซี อินดัสเตรียล อินเวสเมนท์,SET,PROPCON,PF&REIT
440,MILL,บริษัท มิลล์คอน สตีล จำกัด (มหาชน),SET,INDUS,STEEL
441,MINT,บริษัท ไมเนอร์ อินเตอร์เนชั่นแนล จำกัด (มหาชน),SET,SERVICE,TOURISM
442,MIPF,กองทุนรวมอสังหาริมทรัพย์มิลเลียนแนร์,SET,PROPCON,PF&REIT
443,MIT,ทรัสต์เพื่อการลงทุนในอสังหาริมทรัพย์เอ็มเอฟซีอินดัสเตรียล,SET,PROPCON,PF&REIT
444,MITSIB,บริษัท มิตรสิบ ลิสซิ่ง จำกัด (มหาชน),mai,FINCIAL,
445,MJD,บริษัท เมเจอร์ ดีเวลลอปเม้นท์ จำกัด (มหาชน),SET,PROPCON,PROP
446,MJLF,กองทุนรวมสิทธิการเช่าอสังหาฯ เมเจอร์ ซีนีเพล็กซ์ ไลฟ์สไตส์,SET,PROPCON,PF&REIT
447,MK,บริษัท มั่นคงเคหะการ จำกัด (มหาชน),SET,PROPCON,PROP
448,ML,บริษัท ไมด้า ลิสซิ่ง จำกัด (มหาชน),SET,FINCIAL,FIN
449,MNIT,กองทุนรวมอสังหาริมทรัพย์เอ็มเอฟซี-นิชดาธานี,SET,PROPCON,PF&REIT
450,MNIT2,กองทุนรวมอสังหาริมทรัพย์นิชดาธานี 2,SET,PROPCON,PF&REIT
451,MNRF,กองทุนรวมอสังหาริมทรัพย์มัลติเนชั่นแนลเรสซิเดนซ์ฟันด์,SET,PROPCON,PF&REIT
452,MODERN,บริษัท โมเดอร์นฟอร์มกรุ๊ป จำกัด (มหาชน),SET,CONSUMP,HOME
453,MONO,บริษัท โมโน เน็กซ์ จำกัด (มหาชน),SET,SERVICE,MEDIA
454,MOONG,บริษัท มุ่งพัฒนา อินเตอร์แนชชั่นแนล จำกัด (มหาชน),mai,CONSUMP,
455,MORE,บริษัท มอร์ รีเทิร์น จำกัด (มหาชน),mai,SERVICE,
456,MOSHI,บริษัท โมชิ โมชิ รีเทล คอร์ปอเรชั่น จำกัด (มหาชน),SET,SERVICE,COMM
457,M-PAT,กองทุนรวมอสังหาริมทรัพย์เอ็มเอฟซี ป่าตอง เฮอริเทจ,SET,PROPCON,PF&REIT
458,MSC,บริษัท เมโทรซิสเต็มส์คอร์ปอเรชั่น จำกัด (มหาชน),SET,TECH,ICT
459,MST,บริษัทหลักทรัพย์ เมย์แบงก์ (ประเทศไทย) จำกัด (มหาชน),SET,FINCIAL,FIN
460,M-STOR,กองทุนรวมอสังหาริมทรัพย์เอ็มเอฟซี-สแตรทิจิกสโตเรจฟันด์,SET,PROPCON,PF&REIT
461,MTC,บริษัท เมืองไทย แคปปิตอล จำกัด (มหาชน),SET,FINCIAL,FIN
462,MTI,บริษัท เมืองไทยประกันภัย จำกัด (มหาชน),SET,FINCIAL,INSUR
463,MTW,บริษัท เมคทูวิน โฮลดิ้ง จำกัด (มหาชน),mai,INDUS,
464,MUD,บริษัท มัด แอนด์ ฮาวด์ จำกัด (มหาชน),mai,AGRO,
465,MVP,บริษัท เอ็ม วิชั่น จำกัด (มหาชน),mai,SERVICE,
466,NAM,บริษัท นำวิวัฒน์ เมดิคอล คอร์ปอเรชั่น จำกัด (มหาชน),SET,CONSUMP,PERSON
467,NAT,บริษัท แนท แอบโซลูท เทคโนโลยีส์ จำกัด (มหาชน),mai,TECH,
468,NATION,บริษัท เนชั่น กรุ๊ป (ไทยแลนด์) จำกัด (มหาชน),SET,SERVICE,MEDIA
469,NC,บริษัท นิวซิตี้ (กรุงเทพฯ) จำกัด (มหาชน),SET,CONSUMP,FASHION
470,NCAP,บริษัท เน็คซ์ แคปปิตอล จำกัด (มหาชน),SET,FINCIAL,FIN
471,NCH,บริษัท เอ็น. ซี. เฮ้าส์ซิ่ง จำกัด (มหาชน),SET,PROPCON,PROP
472,NCL,บริษัท เอ็นซีแอล อินเตอร์เนชั่นแนล โลจิสติกส์ จำกัด (มหาชน),mai,SERVICE,
473,NCP,บริษัท ไนซ์ คอล จำกัด (มหาชน),mai,SERVICE,
474,NDR,บริษัท เอ็น.ดี.รับเบอร์ จำกัด (มหาชน),mai,INDUS,
475,NEO,บริษัท นีโอ คอร์ปอเรท จำกัด (มหาชน),SET,CONSUMP,PERSON
476,NEP,บริษัท เอ็นอีพี อสังหาริมทรัพย์ และอุตสาหกรรม จำกัด (มหาชน),SET,INDUS,PKG
477,NER,บริษัท นอร์ทอีส รับเบอร์ จำกัด (มหาชน),SET,AGRO,AGRI
478,NETBAY,บริษัท เน็ตเบย์ จำกัด (มหาชน),mai,TECH,
479,NEW,บริษัท วัฒนาการแพทย์ จำกัด (มหาชน),SET,SERVICE,HELTH
480,NEWS,บริษัท นิวส์ เน็ตเวิร์ค คอร์ปอเรชั่น จำกัด (มหาชน),mai,SERVICE,
481,NEX,บริษัท เน็กซ์ พอยท์ จำกัด (มหาชน),SET,INDUS,AUTO
482,NFC,บริษัท เอ็นเอฟซี จำกัด (มหาชน),SET,INDUS,PETRO
483,NKI,บริษัท นวกิจประกันภัย จำกัด (มหาชน),SET,FINCIAL,INSUR
484,NL,บริษัท เอ็นแอล ดีเวลลอปเมนต์ จำกัด (มหาชน),SET,PROPCON,CONS
485,NNCL,บริษัท นวนคร จำกัด (มหาชน),SET,PROPCON,PROP
486,NOBLE,บริษัท โนเบิล ดีเวลลอปเมนท์ จำกัด (มหาชน),SET,PROPCON,PROP
487,NOK,บริษัท สายการบินนกแอร์ จำกัด (มหาชน),SET,SERVICE,TRANS
488,NOVA,บริษัท โนวา เอมไพร์ จำกัด (มหาชน),SET,RESOURC,ENERG
489,NPK,บริษัท นิวพลัสนิตติ้ง จำกัด (มหาชน),mai,CONSUMP,
490,NRF,บริษัท เอ็นอาร์ อินสแตนท์ โปรดิวซ์ จำกัด (มหาชน),SET,AGRO,FOOD
491,NSL,บริษัท เอ็นเอสแอล ฟู้ดส์ จำกัด (มหาชน),SET,AGRO,FOOD
492,NTSC,บริษัท นิวทรีชั่น เอสซี จำกัด (มหาชน),mai,AGRO,
493,NTV,บริษัท โรงพยาบาลนนทเวช จำกัด (มหาชน),SET,SERVICE,HELTH
494,NUSA,บริษัท ณุศาศิริ จำกัด (มหาชน),SET,PROPCON,PROP
495,NV,บริษัท โนวา ออร์แกนิค จำกัด (มหาชน),SET,CONSUMP,PERSON
496,NVD,บริษัท เนอวานา ดีเวลลอปเม้นท์ จำกัด (มหาชน),SET,PROPCON,PROP
497,NWR,บริษัทเนาวรัตน์พัฒนาการ จำกัด (มหาชน),SET,PROPCON,CONS
498,NYT,บริษัท นามยง เทอร์มินัล จำกัด (มหาชน),SET,SERVICE,TRANS
499,OCC,บริษัท โอ ซี ซี จำกัด (มหาชน),SET,CONSUMP,PERSON
500,OGC,บริษัท โอเชียนกลาส จำกัด (มหาชน),SET,CONSUMP,HOME
501,OHTL,บริษัท โอเอชทีแอล จำกัด (มหาชน),SET,SERVICE,TOURISM
502,ONEE,บริษัท เดอะ วัน เอ็นเตอร์ไพรส์ จำกัด (มหาชน),SET,SERVICE,MEDIA
503,OR,บริษัท ปตท. น้ำมันและการค้าปลีก จำกัด (มหาชน),SET,RESOURC,ENERG
504,ORI,บริษัท ออริจิ้น พร็อพเพอร์ตี้ จำกัด (มหาชน),SET,PROPCON,PROP
505,ORN,บริษัท อรสิริน โฮลดิ้ง จํากัด (มหาชน),SET,PROPCON,PROP
506,OSP,บริษัท โอสถสภา จำกัด (มหาชน),SET,AGRO,FOOD
507,PACO,บริษัท เพรสซิเด้นท์ ออโตโมบิล อินดัสทรีส์ จำกัด (มหาชน),mai,INDUS,
508,PAF,บริษัท แพนเอเซียฟุตแวร์ จำกัด (มหาชน),SET,CONSUMP,FASHION
509,PANEL,บริษัท เพเนเล่ส์มาติก โซลูชั่นส์ จำกัด (มหาชน),mai,PROPCON,
510,PAP,บริษัท แปซิฟิกไพพ์ จำกัด (มหาชน),SET,INDUS,STEEL
511,PATO,บริษัท พาโตเคมีอุตสาหกรรม จำกัด (มหาชน),SET,INDUS,PETRO
512,PB,บริษัท เพรซิเดนท์ เบเกอรี่ จำกัด (มหาชน),SET,AGRO,FOOD
513,PCC,บริษัท พรีไซซ คอร์ปอเรชั่น จำกัด (มหาชน),SET,INDUS,IMM
514,PCE,บริษัท เพชรศรีวิชัย เอ็นเตอร์ไพรส์ จำกัด (มหาชน),SET,AGRO,AGRI
515,PCSGH,บริษัท พี.ซี.เอส.แมชีน กรุ๊ปโฮลดิ้ง จำกัด (มหาชน),SET,INDUS,AUTO
516,PDG,บริษัท พรอดดิจิ จำกัด (มหาชน),mai,INDUS,
517,PDJ,บริษัท แพรนด้า จิวเวลรี่ จำกัด (มหาชน),SET,CONSUMP,FASHION
518,PEACE,บริษัท พีซแอนด์ลีฟวิ่ง จำกัด (มหาชน),SET,PROPCON,PROP
519,PEER,บริษัท เพียร์ ฟอร์ ยู จำกัด (มหาชน),mai,SERVICE,
520,PERM,บริษัท เพิ่มสินสตีลเวิคส์ จำกัด (มหาชน),SET,INDUS,STEEL
521,PF,บริษัท พร็อพเพอร์ตี้ เพอร์เฟค จำกัด (มหาชน),SET,PROPCON,PROP
522,PG,บริษัท ประชาอาภรณ์ จำกัด (มหาชน),SET,CONSUMP,FASHION
523,PHG,บริษัท แพทย์รังสิตเฮลท์แคร์กรุ๊ป จำกัด (มหาชน),SET,SERVICE,HELTH
524,PHOL,บริษัท ผลธัญญะ จำกัด (มหาชน),mai,INDUS,
525,PICO,บริษัท ปิโก (ไทยแลนด์) จำกัด (มหาชน),mai,SERVICE,
526,PIMO,บริษัท ไพโอเนียร์ มอเตอร์ จำกัด (มหาชน),mai,INDUS,
527,PIN,บริษัท ปิ่นทอง อินดัสเตรียล ปาร์ค จำกัด (มหาชน),SET,PROPCON,PROP
528,PJW,บริษัท ปัญจวัฒนาพลาสติก จำกัด (มหาชน),SET,INDUS,PKG
529,PK,บริษัท พัฒน์กล จำกัด (มหาชน),SET,INDUS,IMM
530,PL,บริษัท ภัทรลิสซิ่ง จำกัด (มหาชน),SET,FINCIAL,FIN
531,PLANB,บริษัท แพลน บี มีเดีย จำกัด (มหาชน),SET,SERVICE,MEDIA
532,PLANET,บริษัท แพลนเน็ต คอมมิวนิเคชั่น เอเชีย จำกัด (มหาชน),mai,TECH,
533,PLAT,บริษัท เดอะ แพลทินัม กรุ๊ป จำกัด (มหาชน),SET,PROPCON,PROP
534,PLE,บริษัท เพาเวอร์ไลน์ เอ็นจิเนียริ่ง จำกัด (มหาชน),SET,PROPCON,CONS
535,PLT,บริษัท พีลาทัส มารีน จำกัด (มหาชน),mai,SERVICE,
536,PLUS,บริษัท โรแยล พลัส จำกัด (มหาชน),SET,AGRO,FOOD
537,PM,บริษัท พรีเมียร์ มาร์เก็ตติ้ง จำกัด (มหาชน),SET,AGRO,FOOD
538,PMC,บริษัท พีเอ็มซี เลเบิล แมททีเรียลส์ จำกัด (มหาชน),mai,INDUS,
539,PMTA,บริษัท พีเอ็ม โทรีเซน เอเชีย โฮลดิ้งส์ จำกัด (มหาชน),SET,INDUS,PETRO
540,POLAR,บริษัท โพลาริส แคปปิตัล จำกัด (มหาชน),SET,PROPCON,PROP
541,POLY,บริษัท โพลีเน็ต จำกัด (มหาชน),SET,INDUS,AUTO
542,POPF,กองทุนรวมสิทธิการเช่าอสังหาริมทรัพย์ไพร์มออฟฟิศ,SET,PROPCON,PF&REIT
543,PORT,บริษัท สหไทย เทอร์มินอล จำกัด (มหาชน),SET,SERVICE,TRANS
544,PPM,บริษัท พรพรหมเม็ททอล จำกัด (มหาชน),mai,INDUS,
545,PPP,บริษัท พรีเมียร์ โพรดักส์ จำกัด (มหาชน),SET,PROPCON,CONMAT
546,PPPM,บริษัท พีพี ไพร์ม จำกัด (มหาชน),SET,AGRO,AGRI
547,PPS,บริษัท โปรเจค แพลนนิ่ง เซอร์วิส จำกัด (มหาชน),mai,PROPCON,
548,PQS,บริษัท พรีเมียร์ควอลิตี้สตาร์ช จำกัด (มหาชน),SET,AGRO,FOOD
549,PR9,บริษัท โรงพยาบาลพระรามเก้า จำกัด (มหาชน),SET,SERVICE,HELTH
550,PRAKIT,บริษัท ประกิต โฮลดิ้งส์ จำกัด (มหาชน),SET,SERVICE,MEDIA
551,PRAPAT,บริษัท พีรพัฒน์ เทคโนโลยี จำกัด (มหาชน),mai,INDUS,
552,PREB,บริษัท พรีบิลท์ จำกัด (มหาชน),SET,PROPCON,CONS
553,PRECHA,บริษัท ปรีชากรุ๊ป จำกัด (มหาชน),SET,PROPCON,PROP
554,PRG,บริษัท พี อาร์ จี คอร์ปอเรชั่น จำกัด (มหาชน),SET,AGRO,FOOD
555,PRI,บริษัท พรีโม เซอร์วิส โซลูชั่น จำกัด (มหาชน),mai,PROPCON,
556,PRIME,บริษัท ไพร์ม โรด เพาเวอร์ จำกัด (มหาชน),SET,RESOURC,ENERG
557,PRIN,บริษัท ปริญสิริ จำกัด (มหาชน),SET,PROPCON,PROP
558,PRINC,บริษัท พริ้นซิเพิล แคปิตอล จำกัด (มหาชน),SET,SERVICE,HELTH
559,PRM,บริษัท พริมา มารีน จำกัด (มหาชน),SET,SERVICE,TRANS
560,PRO,บริษัท โปรเฟสชั่นแนล เวสต์ เทคโนโลยี (1999) จำกัด (มหาชน),SET,SERVICE,PROF
561,PROEN,บริษัท โปรเอ็น คอร์ป จำกัด (มหาชน),mai,TECH,
562,PROS,บริษัท พรอสเพอร์ เอ็นจิเนียริ่ง จำกัด (มหาชน),mai,PROPCON,
563,PROSPECT,ทรัสต์เพื่อการลงทุนในอสังหาริมทรัพย์และสิทธิการเช่าอสังหาริมทรัพย์ พรอสเพค โลจิสติกส์และอินดัสเทรียล,SET,PROPCON,PF&REIT
564,PROUD,บริษัท พราว เรียล เอสเตท จำกัด (มหาชน),SET,PROPCON,PROP
