,symbol,full name,market,sector,sub-sector
565,PRTR,บริษัท พีอาร์ทีอาร์ กรุ๊ป จำกัด (มหาชน),SET,SERVICE,PROF
566,PSG,บริษัท พีเอสจี คอร์ปอเรชั่น จำกัด (มหาชน),mai,PROPCON,
567,PSH,บริษัท พฤกษา โฮลดิ้ง จำกัด (มหาชน),SET,PROPCON,PROP
568,PSL,บริษัท พรีเชียส ชิพปิ้ง จำกัด (มหาชน),SET,SERVICE,TRANS
569,PSP,บริษัท พี.เอส.พี.สเปเชียลตี้ส์ จำกัด (มหาชน),SET,INDUS,IMM
570,PSTC,บริษัท เพาเวอร์ โซลูชั่น เทคโนโลยี จำกัด (มหาชน),mai,RESOURC,
571,PT,บริษัท พรีเมียร์ เทคโนโลยี จำกัด (มหาชน),SET,TECH,ICT
572,PTC,บริษัท พรีเมียร์ แทงค์ คอร์ปอเรชั่น จำกัด (มหาชน),mai,RESOURC,
573,PTECH,บริษัท พลัส เทค อินโนเวชั่น จำกัด (มหาชน),SET,SERVICE,MEDIA
574,PTG,บริษัท พีทีจี เอ็นเนอยี จำกัด (มหาชน),SET,RESOURC,ENERG
575,PTL,บริษัท โพลีเพล็กซ์ (ประเทศไทย) จำกัด (มหาชน),SET,INDUS,PKG
576,PTT,บริษัท ปตท. จำกัด (มหาชน),SET,RESOURC,ENERG
577,PTTEP,บริษัท ปตท.สำรวจและผลิตปิโตรเลียม จำกัด (มหาชน),SET,RESOURC,ENERG
578,PTTGC,บริษัท พีทีที โกลบอล เคมิคอล จำกัด (มหาชน),SET,INDUS,PETRO
579,PYLON,บริษัท ไพลอน จำกัด (มหาชน),SET,PROPCON,CONS
580,Q-CON,บริษัท ควอลิตี้คอนสตรัคชั่นโปรดัคส์ จำกัด (มหาชน),SET,PROPCON,CONMAT
581,QH,บริษัท ควอลิตี้เฮ้าส์ จำกัด (มหาชน),SET,PROPCON,PROP
582,QHHRREIT,ทรัสต์เพื่อการลงทุนในอสังหาริมทรัพย์และสิทธิการเช่า ควอลิตี้ เฮ้าส์ โฮเทล แอนด์ เรซิเดนซ์,SET,PROPCON,PF&REIT
583,QHOP,กองทุนรวมสิทธิการเช่าอสังหาริมทรัพย์ควอลิตี้ ฮอสพิทอลลิตี้,SET,PROPCON,PF&REIT
584,QHPF,กองทุนรวมสิทธิการเช่าอสังหาริมทรัพย์ควอลิตี้ เฮ้าส์,SET,PROPCON,PF&REIT
585,QLT,บริษัท ควอลลีเทค จำกัด (มหาชน),mai,SERVICE,
586,QTC,บริษัท คิวทีซี เอนเนอร์ยี่ จำกัด (มหาชน),SET,INDUS,IMM
587,QTCG,บริษัท คิวทีซีจี จำกัด (มหาชน),mai,PROPCON,
588,RABBIT,บริษัท แรบบิท โฮลดิ้งส์ จำกัด (มหาชน),SET,PROPCON,PROP
589,RAM,บริษัท โรงพยาบาลรามคำแหง จำกัด (มหาชน),SET,SERVICE,HELTH
590,RATCH,บริษัท ราช กรุ๊ป จำกัด (มหาชน),SET,RESOURC,ENERG
591,RBF,บริษัท อาร์ แอนด์ บี ฟู้ด ซัพพลาย จำกัด (มหาชน),SET,AGRO,FOOD
592,RCL,บริษัท อาร์ ซี แอล จำกัด (มหาชน),SET,SERVICE,TRANS
593,READY,บริษัท เรดดี้แพลนเน็ต จำกัด (มหาชน),mai,TECH,
594,RICHY,บริษัท ริชี่ เพลซ 2002 จำกัด (มหาชน),SET,PROPCON,PROP
595,RJH,บริษัท โรงพยาบาลราชธานี จำกัด (มหาชน),SET,SERVICE,HELTH
596,RML,บริษัท ไรมอน แลนด์ จำกัด (มหาชน),SET,PROPCON,PROP
597,ROCK,บริษัท ร้อกเวิธ จำกัด (มหาชน),SET,CONSUMP,HOME
598,ROCTEC,บริษัท ร็อคเทค โกลบอล จำกัด (มหาชน),SET,TECH,ICT
599,ROH,บริษัท โรงแรมรอยัล ออคิด (ประเทศไทย) จำกัด (มหาชน),SET,SERVICE,TOURISM
600,ROJNA,บริษัท สวนอุตสาหกรรมโรจนะ จำกัด (มหาชน),SET,PROPCON,PROP
601,RP,บริษัท ท่าเรือราชาเฟอร์รี่ จำกัด (มหาชน),mai,SERVICE,
602,RPC,บริษัท อาร์พีซีจี จำกัด (มหาชน),SET,RESOURC,ENERG
603,RPH,บริษัท โรงพยาบาลราชพฤกษ์ จำกัด (มหาชน),SET,SERVICE,HELTH
604,RS,บริษัท อาร์เอส จำกัด (มหาชน),SET,SERVICE,COMM
605,RSP,บริษัท ริช สปอร์ต จำกัด (มหาชน),SET,SERVICE,COMM
606,RT,บริษัท ไร้ท์ทันเน็ลลิ่ง จำกัด (มหาชน),SET,PROPCON,CONS
607,RWI,บริษัท ระยองไวร์ อินดัสตรีส์ จำกัด (มหาชน),mai,INDUS,
608,S,บริษัท สิงห์ เอสเตท จำกัด (มหาชน),SET,PROPCON,PROP
609,S&J,บ.เอส แอนด์ เจ อินเตอร์เนชั่นแนล เอนเตอร์ไพรส์ จำกัด (มหาชน),SET,CONSUMP,PERSON
610,S11,บริษัท เอส 11 กรุ๊ป จำกัด (มหาชน),SET,FINCIAL,FIN
611,SA,บริษัท ไซมิส แอสเสท จำกัด (มหาชน),SET,PROPCON,PROP
612,SAAM,บริษัท เอสเอเอเอ็ม ดีเวลลอปเมนท์ จำกัด (มหาชน),mai,RESOURC,
613,SABINA,บริษัท ซาบีน่า จำกัด (มหาชน),SET,CONSUMP,FASHION
614,SABUY,บริษัท สบาย เทคโนโลยี จำกัด (มหาชน),SET,SERVICE,COMM
615,SAF,บริษัท เอส.เอ.เอฟ. สเปเชียล สตีล จำกัด (มหาชน),mai,INDUS,
616,SAFARI,บริษัท ซาฟารีเวิลด์ จำกัด (มหาชน),SET,REHABCO,
617,SAFE,บริษัท เซฟ เฟอร์ทิลิตี้ กรุ๊ป จำกัด (มหาชน),SET,SERVICE,HELTH
618,SAK,บริษัท ศักดิ์สยามลิสซิ่ง จำกัด (มหาชน),SET,FINCIAL,FIN
619,SALEE,บริษัท สาลี่อุตสาหกรรม จำกัด (มหาชน),mai,INDUS,
620,SAM,บริษัท สามชัย สตีล อินดัสทรี จำกัด (มหาชน),SET,INDUS,STEEL
621,SAMART,บริษัท สามารถคอร์ปอเรชั่น จำกัด (มหาชน),SET,TECH,ICT
622,SAMCO,บริษัท สัมมากร จำกัด (มหาชน),SET,PROPCON,PROP
623,SAMTEL,บริษัท สามารถเทลคอม จำกัด (มหาชน),SET,TECH,ICT
624,SANKO,บริษัท ซังโกะ ไดคาซติ้ง (ประเทศไทย) จำกัด (มหาชน),mai,INDUS,
625,SAPPE,บริษัท เซ็ปเป้ จำกัด (มหาชน),SET,AGRO,FOOD
626,SAT,บริษัท สมบูรณ์ แอ๊ดวานซ์ เทคโนโลยี จำกัด (มหาชน),SET,INDUS,AUTO
627,SAUCE,บริษัท ไทยเทพรส จำกัด (มหาชน),SET,AGRO,FOOD
628,SAV,บริษัท สามารถ เอวิเอชั่น โซลูชั่นส์ จำกัด (มหาชน),SET,SERVICE,TRANS
629,SAWAD,บริษัท ศรีสวัสดิ์ คอร์ปอเรชั่น จำกัด (มหาชน),SET,FINCIAL,FIN
630,SAWANG,บริษัท สว่างเอ็กซ์ปอร์ต จำกัด (มหาชน),SET,CONSUMP,FASHION
631,SBNEXT,บริษัท สบาย คอนเน็กซ์ เทค จำกัด (มหาชน),SET,CONSUMP,HOME
632,SC,บริษัท เอสซี แอสเสท คอร์ปอเรชั่น จำกัด (มหาชน),SET,PROPCON,PROP
633,SCAP,บริษัท ศรีสวัสดิ์ แคปปิตอล 1969 จำกัด (มหาชน),SET,FINCIAL,FIN
634,SCB,บริษัท เอสซีบี เอกซ์ จำกัด (มหาชน),SET,FINCIAL,BANK
635,SCC,บริษัท ปูนซิเมนต์ไทย จำกัด(มหาชน),SET,PROPCON,CONMAT
636,SCCC,บริษัท ปูนซีเมนต์นครหลวง จำกัด (มหาชน),SET,PROPCON,CONMAT
637,SCG,บริษัท ราชพัฒนา เอ็นเนอร์ยี จำกัด (มหาชน),SET,RESOURC,ENERG
638,SCGD,บริษัท เอสซีจี เดคคอร์ จำกัด (มหาชน),SET,PROPCON,CONMAT
639,SCGP,บริษัท เอสซีจี แพคเกจจิ้ง จำกัด (มหาชน),SET,INDUS,PKG
640,SCI,บริษัท เอสซีไอ อีเลคตริค จำกัด (มหาชน),SET,INDUS,IMM
641,SCL,บริษัท เอส.ซี.แอล.มอเตอร์ พาร์ท จำกัด (มหาชน),mai,INDUS,
642,SCM,บริษัท ซัคเซสมอร์ บีอิ้งค์ จำกัด (มหาชน),SET,SERVICE,COMM
643,SCN,บริษัท สแกน อินเตอร์ จำกัด (มหาชน),SET,RESOURC,ENERG
644,SCP,บริษัท ทักษิณคอนกรีต จำกัด (มหาชน),SET,PROPCON,CONMAT
645,SDC,บริษัท สามารถ ดิจิตอล จำกัด (มหาชน),SET,TECH,ICT
646,SE,บริษัท สยามอีสต์ โซลูชั่น จำกัด (มหาชน),SET,INDUS,IMM
647,SEAFCO,บริษัท ซีฟโก้ จำกัด (มหาชน),SET,PROPCON,CONS
648,SEAOIL,บริษัท ซีออยล์ จำกัด (มหาชน),SET,RESOURC,ENERG
649,SECURE,บริษัท เอ็นฟอร์ซ ซีเคียว จำกัด (มหาชน),mai,TECH,
650,SE-ED,บริษัท ซีเอ็ดยูเคชั่น จำกัด (มหาชน),SET,SERVICE,MEDIA
651,SELIC,บริษัท ซีลิค คอร์พ จำกัด (มหาชน),mai,INDUS,
652,SENA,บริษัท เสนาดีเวลลอปเม้นท์ จำกัด (มหาชน),SET,PROPCON,PROP
653,SENX,บริษัท เซ็น เอกซ์ จำกัด (มหาชน),mai,PROPCON,
654,SFLEX,บริษัท สตาร์เฟล็กซ์ จำกัด (มหาชน),SET,INDUS,PKG
655,SFT,บริษัท ชริ้งเฟล็กซ์ (ประเทศไทย) จำกัด (มหาชน),mai,INDUS,
656,SGC,บริษัท เอสจี แคปปิตอล จำกัด (มหาชน),SET,FINCIAL,FIN
657,SGF,บริษัท เอสจีเอฟ แคปปิตอล จำกัด (มหาชน),mai,FINCIAL,
658,SGP,บริษัท สยามแก๊ส แอนด์ ปิโตรเคมีคัลส์ จำกัด (มหาชน),SET,RESOURC,ENERG
659,SHANG,บริษัท แชงกรี-ลา โฮเต็ล จำกัด (มหาชน),SET,SERVICE,TOURISM
660,SHR,บริษัท เอส โฮเทล แอนด์ รีสอร์ท จำกัด (มหาชน),SET,SERVICE,TOURISM
661,SIAM,บริษัท สยามสตีลอินเตอร์เนชั่นแนล จำกัด (มหาชน),SET,CONSUMP,HOME
662,SICT,บริษัท ซิลิคอน คราฟท์ เทคโนโลยี จำกัด (มหาชน),mai,TECH,
663,SIMAT,บริษัท ไซแมท เทคโนโลยี จำกัด (มหาชน),mai,TECH,
664,SINGER,บริษัท ซิงเกอร์ประเทศไทย จำกัด (มหาชน),SET,SERVICE,COMM
665,SINO,บริษัท ไซโน โลจิสติกส์ คอร์ปอเรชั่น จำกัด (มหาชน),SET,SERVICE,TRANS
666,SIRI,บริษัท แสนสิริ จำกัด (มหาชน),SET,PROPCON,PROP
667,SIRIP,กองทุนรวมอสังหาริมทรัพย์แสนสิริ ไพร์มออฟฟิศ,SET,PROPCON,PF&REIT
668,SIS,บริษัท เอสไอเอส ดิสทริบิวชั่น (ประเทศไทย) จำกัด (มหาชน),SET,TECH,ICT
669,SISB,บริษัท เอสไอเอสบี จำกัด (มหาชน),SET,SERVICE,PROF
670,SITHAI,บริษัท ศรีไทยซุปเปอร์แวร์ จำกัด (มหาชน),SET,INDUS,PKG
671,SJWD,บริษัท เอสซีจี เจดับเบิ้ลยูดี โลจิสติกส์ จำกัด (มหาชน),SET,SERVICE,TRANS
672,SK,บริษัท ศิรกร จำกัด (มหาชน),mai,PROPCON,
673,SKE,บริษัท สากล เอนเนอยี จำกัด (มหาชน),SET,RESOURC,ENERG
674,SKN,บริษัท ส.กิจชัย เอ็นเตอร์ไพรส์ จำกัด (มหาชน),SET,PROPCON,CONMAT
675,SKR,บริษัท ศิครินทร์ จำกัด (มหาชน),SET,SERVICE,HELTH
676,SKY,บริษัท สกาย ไอซีที จำกัด (มหาชน),SET,TECH,ICT
677,SLM,บริษัท เอส แอล เอ็ม คอร์ปอเรชั่น จำกัด (มหาชน),mai,SERVICE,
678,SLP,บริษัท สาลี่ พริ้นท์ติ้ง จำกัด (มหาชน),SET,INDUS,PKG
679,SM,บริษัท สตาร์ มันนี่ จำกัด (มหาชน),SET,FINCIAL,FIN
680,SMART,บริษัท สมาร์ทคอนกรีต จำกัด (มหาชน),mai,PROPCON,
681,SMD,บริษัท เซนต์เมด จำกัด (มหาชน),mai,CONSUMP,
682,SMIT,บริษัท สหมิตรเครื่องกล จำกัด (มหาชน),SET,INDUS,STEEL
683,SMK,บริษัท สินมั่นคงประกันภัย จำกัด (มหาชน),SET,FINCIAL,INSUR
684,SMPC,บริษัท สหมิตรถังแก๊ส จำกัด (มหาชน),SET,INDUS,PKG
685,SMT,บริษัท สตาร์ส ไมโครอิเล็กทรอนิกส์ (ประเทศไทย) จำกัด (มหาชน),SET,TECH,ETRON
686,SNC,บริษัท เอส เอ็น ซี ฟอร์เมอร์ จำกัด (มหาชน),SET,INDUS,IMM
687,SNNP,บริษัท ศรีนานาพร มาร์เก็ตติ้ง จำกัด (มหาชน),SET,AGRO,FOOD
688,SNP,บริษัท เอส แอนด์ พี ซินดิเคท จำกัด (มหาชน),SET,AGRO,FOOD
689,SO,บริษัท สยามราชธานี จำกัด (มหาชน),SET,SERVICE,PROF
690,SOLAR,บริษัท โซลาร์ตรอน จำกัด (มหาชน),SET,RESOURC,ENERG
691,SONIC,บริษัท โซนิค อินเตอร์เฟรท จำกัด (มหาชน),mai,SERVICE,
692,SORKON,บริษัท ส. ขอนแก่นฟู้ดส์ จำกัด (มหาชน),SET,AGRO,FOOD
693,SPA,บริษัท สยามเวลเนสกรุ๊ป จำกัด (มหาชน),SET,SERVICE,TOURISM
694,SPACK,บริษัท เอส. แพ็ค แอนด์ พริ้นท์ จำกัด (มหาชน),SET,INDUS,PKG
695,SPALI,บริษัท ศุภาลัย จำกัด (มหาชน),SET,PROPCON,PROP
696,SPC,บริษัท สหพัฒนพิบูล จำกัด (มหาชน),SET,SERVICE,COMM
697,SPCG,บริษัท เอสพีซีจี จำกัด (มหาชน),SET,RESOURC,ENERG
698,SPG,บริษัท สยามภัณฑ์กรุ๊ป จำกัด (มหาชน),SET,INDUS,AUTO
699,SPI,บริษัท สหพัฒนาอินเตอร์โฮลดิ้ง จำกัด (มหาชน),SET,SERVICE,COMM
700,SPRC,บริษัท สตาร์ ปิโตรเลียม รีไฟน์นิ่ง จำกัด (มหาชน),SET,RESOURC,ENERG
701,SPREME,บริษัท สุพรีม ดิสทิบิวชั่น จำกัด (มหาชน),SET,TECH,ICT
702,SPRIME,ทรัสต์เพื่อการลงทุนในสิทธิการเช่าอสังหาริมทรัพย์ เอส ไพรม์ โกรท,SET,PROPCON,PF&REIT
703,SPVI,บริษัท เอส พี วี ไอ จำกัด (มหาชน),mai,TECH,
704,SQ,บริษัท สหกลอิควิปเมนท์ จำกัด (มหาชน),SET,PROPCON,CONS
705,SR,บริษัท สยามราช จำกัด (มหาชน),mai,RESOURC,
706,SRICHA,บริษัท ศรีราชาคอนสตรัคชั่น จำกัด (มหาชน),SET,PROPCON,CONS
707,SRIPANWA,ทรัสต์เพื่อการลงทุนในอสังหาริมทรัพย์โรงแรมศรีพันวา,SET,PROPCON,PF&REIT
708,SRS,บริษัท สิริซอฟต์ จำกัด (มหาชน),mai,TECH,
709,SSC,บริษัท เสริมสุข จำกัด (มหาชน),SET,AGRO,FOOD
710,SSF,บริษัท สุรพลฟู้ดส์ จำกัด (มหาชน),SET,AGRO,FOOD
711,SSP,บริษัท เสริมสร้าง พาวเวอร์ คอร์ปอเรชั่น จำกัด (มหาชน),SET,RESOURC,ENERG
712,SSPF,กองทุนรวมอสังหาริมทรัพย์ศาลาแอทสาทร,SET,PROPCON,PF&REIT
713,SSSC,บริษัท ศูนย์บริการเหล็กสยาม จำกัด (มหาชน),SET,INDUS,STEEL
714,SST,บริษัท ทรัพย์ศรีไทย จำกัด (มหาชน),SET,AGRO,FOOD
715,SSTRT,ทรัสต์เพื่อการลงทุนในอสังหาริมทรัพย์ทรัพย์ศรีไทย,SET,PROPCON,PF&REIT
716,STA,บริษัท ศรีตรังแอโกรอินดัสทรี จำกัด (มหาชน),SET,AGRO,AGRI
717,STANLY,บริษัท ไทยสแตนเลย์การไฟฟ้า จำกัด (มหาชน),SET,INDUS,AUTO
718,STC,บริษัท เอสทีซี คอนกรีตโปรดัคท์ จำกัด (มหาชน),mai,PROPCON,
719,STEC,บริษัท ซิโน-ไทย เอ็นจีเนียริ่งแอนด์คอนสตรัคชั่น จำกัด(มหาชน),SET,PROPCON,CONS
720,STECH,บริษัท สยามเทคนิคคอนกรีต จำกัด (มหาชน),SET,PROPCON,CONMAT
721,STGT,บริษัท ศรีตรังโกลฟส์ (ประเทศไทย) จำกัด (มหาชน),SET,CONSUMP,PERSON
722,STHAI,บริษัท ซันไทยอุตสาหกรรมถุงมือยาง จำกัด (มหาชน),SET,CONSUMP,PERSON
723,STI,บริษัท สโตนเฮ้นจ์ อินเตอร์ จำกัด (มหาชน),SET,PROPCON,CONS
724,STOWER,บริษัท สกาย ทาวเวอร์ จำกัด (มหาชน),mai,RESOURC,
725,STP,บริษัท สหไทยการพิมพ์และบรรจุภัณฑ์ จำกัด (มหาชน),mai,INDUS,
726,STPI,บริษัท เอสทีพี แอนด์ ไอ จำกัด (มหาชน),SET,PROPCON,CONS
727,STX,บริษัท สโตนวัน จำกัด (มหาชน),mai,PROPCON,
728,SUC,บริษัท สหยูเนี่ยน จำกัด (มหาชน),SET,CONSUMP,FASHION
729,SUN,บริษัท ซันสวีท จำกัด (มหาชน),SET,AGRO,FOOD
730,SUPER,บริษัท ซุปเปอร์ เอนเนอร์ยี คอร์เปอเรชั่น จำกัด (มหาชน),SET,RESOURC,ENERG
731,SUSCO,บริษัท ซัสโก้ จำกัด (มหาชน),SET,RESOURC,ENERG
732,SUTHA,บริษัท สุธากัญจน์ จำกัด (มหาชน),SET,INDUS,PETRO
733,SVI,บริษัท เอสวีไอ จำกัด (มหาชน),SET,TECH,ETRON
734,SVOA,บริษัท เอสวีโอเอ จำกัด (มหาชน),SET,TECH,ICT
735,SVR,บริษัท สิวารมณ์ เรียลเอสเตท จำกัด (มหาชน),mai,PROPCON,
736,SVT,บริษัท ซันเวนดิ้ง เทคโนโลยี จำกัด (มหาชน),SET,SERVICE,COMM
737,SWC,บริษัท เชอร์วู้ด คอร์ปอเรชั่น (ประเทศไทย) จำกัด (มหาชน),mai,INDUS,
738,SYMC,บริษัท ซิมโฟนี่ คอมมูนิเคชั่น จำกัด (มหาชน),SET,TECH,ICT
739,SYNEX,บริษัท ซินเน็ค (ประเทศไทย) จำกัด (มหาชน),SET,TECH,ICT
740,SYNTEC,บริษัท ซินเท็ค คอนสตรัคชั่น จำกัด (มหาชน),SET,PROPCON,CONS
741,TACC,บริษัท ที.เอ.ซี. คอนซูเมอร์ จำกัด (มหาชน),mai,AGRO,
742,TAE,บริษัท ไทย อะโกร เอ็นเนอร์ยี่ จำกัด (มหาชน),SET,RESOURC,ENERG
743,TAKUNI,บริษัท ทาคูนิ กรุ๊ป จำกัด (มหาชน),mai,RESOURC,
744,TAN,บริษัท ธนจิรา รีเทล คอร์ปอเรชั่น จำกัด (มหาชน),SET,SERVICE,COMM
745,TAPAC,บริษัท ทาพาโก้ จำกัด (มหาชน),mai,PROPCON,
746,TASCO,บริษัท ทิปโก้แอสฟัลท์ จำกัด (มหาชน),SET,PROPCON,CONMAT
747,TBN,บริษัท ทีบีเอ็น คอร์ปอเรชั่น จำกัด (มหาชน),mai,TECH,
748,TC,บริษัท ทรอปิคอลแคนนิ่ง (ประเทศไทย) จำกัด (มหาชน),SET,AGRO,FOOD
749,TCAP,บริษัท ทุนธนชาต จำกัด (มหาชน),SET,FINCIAL,BANK
750,TCC,บริษัท ไทย แคปปิตอล คอร์ปอเรชั่น จำกัด (มหาชน),SET,RESOURC,ENERG
751,TCJ,บริษัท ที.ซี.เจ.เอเซีย จำกัด (มหาชน),SET,INDUS,IMM
752,TCMC,บริษัท ทีซีเอ็ม คอร์ปอเรชั่น จำกัด (มหาชน),SET,CONSUMP,HOME
753,TCOAT,บริษัท อุตสาหกรรมผ้าเคลือบพลาสติกไทย จำกัด (มหาชน),SET,INDUS,PKG
754,TEAM,บริษัท ทีมพรีซิชั่น จำกัด (มหาชน),SET,TECH,ETRON
755,TEAMG,บริษัท ทีม คอนซัลติ้ง เอนจิเนียริ่ง แอนด์ แมเนจเมนท์ จำกัด (มหาชน),SET,PROPCON,CONS
756,TEGH,บริษัท ไทยอีสเทิร์น กรุ๊ป โฮลดิ้งส์ จำกัด (มหาชน),SET,AGRO,AGRI
757,TEKA,บริษัท ฑีฆาก่อสร้าง จำกัด (มหาชน),SET,PROPCON,CONS
758,TERA,บริษัท เทอร์ราไบท์ พลัส จำกัด (มหาชน),mai,TECH,
759,TFG,บริษัท ไทยฟู้ดส์ กรุ๊ป จำกัด (มหาชน),SET,AGRO,FOOD
760,TFI,บริษัท ไทยฟิวเจอร์อินคอร์ปอเรชั่น จำกัด (มหาชน),SET,INDUS,PKG
